ID,idea001,ideaType,Goal,ideaName,Eliminate,ideaDescription,เป้าหมายคือการทำลายล้าง,iconPath,Icons/Items/RPG/armor,defaultCollected,FALSE,Message,Eliminate
ID,idea002,ideaType,Goal,ideaName,Race,ideaDescription,เป้าหมายคือการแข่งขันให้ได้ที่หนึ่ง,iconPath,Icons/Items/RPG/axe,defaultCollected,TRUE,Message,Race
ID,idea003,ideaType,Goal,ideaName,Collection,ideaDescription,เป้าหมายคือการสะสมสิ่งของ,iconPath,Icons/Items/RPG/armor,defaultCollected,FALSE,Message,Collection
ID,idea004,ideaType,Goal,ideaName,Guard,ideaDescription,เป้าหมายคือการป้องกันบางสิ่ง,iconPath,Icons/Items/RPG/apple,defaultCollected,FALSE,Message,Guard
ID,idea005,ideaType,Goal,ideaName,Survice,ideaDescription,เป้าหมายคือการเอาชีวิตรอด,iconPath,Icons/Items/RPG/gem,defaultCollected,FALSE,Message,Survice
ID,idea006,ideaType,Goal,ideaName,Exploration,ideaDescription,เป้าหมายคือการสำรวจ,iconPath,Icons/Items/RPG/scroll,defaultCollected,FALSE,Message,Exploration
ID,idea007,ideaType,Goal,ideaName,Building,ideaDescription,เป้าหมายคือการสร้างบางอย่าง,iconPath,Icons/Items/RPG/shield,defaultCollected,FALSE,Message,Building
ID,idea008,ideaType,Mechanic,ideaName,Roleplay,ideaDescription,กฏภายในเกม,iconPath,Icons/Items/RPG/sword,defaultCollected,FALSE,Message,Roleplay
ID,idea009,ideaType,Mechanic,ideaName,Shooting,ideaDescription,กฏภายในเกม,iconPath,Icons/Items/RPG/armor,defaultCollected,TRUE,Message,Shooting
ID,idea010,ideaType,Mechanic,ideaName,Idle,ideaDescription,กฏภายในเกม,iconPath,Icons/Items/RPG/axe,defaultCollected,FALSE,Message,Idle
ID,idea011,ideaType,Mechanic,ideaName,Crafting,ideaDescription,กฏภายในเกม,iconPath,Icons/Items/RPG/armor,defaultCollected,FALSE,Message,Crafting
ID,idea012,ideaType,Mechanic,ideaName,Fighting,ideaDescription,กฏภายในเกม,iconPath,Icons/Items/RPG/apple,defaultCollected,FALSE,Message,Fighting
ID,idea013,ideaType,Mechanic,ideaName,Card,ideaDescription,กฏภายในเกม,iconPath,Icons/Items/RPG/gem,defaultCollected,TRUE,Message,Card
ID,idea014,ideaType,Mechanic,ideaName,Battle Arena,ideaDescription,กฏภายในเกม,iconPath,Icons/Items/RPG/scroll,defaultCollected,FALSE,Message,Battle Arena
ID,idea015,ideaType,Mechanic,ideaName,Sport,ideaDescription,กฏภายในเกม,iconPath,Icons/Items/RPG/shield,defaultCollected,FALSE,Message,Sport
ID,idea016,ideaType,Mechanic,ideaName,Farming,ideaDescription,กฏภายในเกม,iconPath,Icons/Items/RPG/sword,defaultCollected,FALSE,Message,Farming
ID,idea017,ideaType,Mechanic,ideaName,Cooking,ideaDescription,กฏภายในเกม,iconPath,Icons/Items/RPG/armor,defaultCollected,FALSE,Message,Cooking
ID,idea018,ideaType,Theme,ideaName,มังกรหลังเกษียณ,ideaDescription,ในโลกที่ครั้งอดีต มังกรคือสิ่งมีชีวิตที่น่าเกรงขามและน่าเกรงกลัว แต่จะเกิดอะไรขึ้นเมื่อเวลาได้เปลี่ยนผัน มังกรผู้แข็งแกร่งผันเปลี่ยนเป็นเพียงผู้อ่อนแอ,iconPath,Icons/Items/RPG/axe,defaultCollected,FALSE,Message,มังกรหลังเกษียณ
ID,idea019,ideaType,Theme,ideaName,จักรพรรดิแห่งไวกิ้ง,ideaDescription,มีเพียงผู้เดียวเท่านั้นที่จะผ่านการทดสอบแห่งท้องทะเลแล้วก้าวขึ้นเป็นเจ้าแห่งมหาสมุทรได้ แต่ใครกันล่ะที่จะมีความสามารถมากพอที่ครอบครองตำแหน่งนี้,iconPath,Icons/Items/RPG/armor,defaultCollected,FALSE,Message,จักรพรรดิแห่งไวกิ้ง
ID,idea020,ideaType,Theme,ideaName,สวนสัตว์แสนสดใส,ideaDescription,สิ่งมีชีวิตนับร้อยสายพันธุ์ ทั้งสัตว์เล็กสัตว์ใหญ่แม้กระทั่งสัตว์หายากต่างถูกรวมรวบไว้ ณ ที่แห่งนี้ พร้อมเปิดให้บริการ ณ บัดนี้,iconPath,Icons/Items/RPG/apple,defaultCollected,TRUE,Message,สวนสัตว์แสนสดใส
ID,idea021,ideaType,Theme,ideaName,ตัวตลกแสนน่าวังเวง,ideaDescription,เขา' คือตัวตลกที่สร้างเสียงหัวเราะให้แก่ทุกคน แต่เพราะเหตุการณ์นั้นทำให้เขาต้องไล่ล่าทุกคนที่ขวางหน้าเพื่อให้ตัวเองมีรอยยิ้ม เหตุการณ์นั้นคืออะไร แล้วจะมีใครไหมที่ปลดปล่อย 'เขา' ได้,iconPath,Icons/Items/RPG/gem,defaultCollected,FALSE,Message,ตัวตลกแสนน่าวังเวง
ID,idea022,ideaType,Theme,ideaName,ขุมสมบัติแห่งป่าต้องห้าม,ideaDescription,ป่าต้องห้ามที่ใครๆก็ไม่คิดจะย่างกรายเข้าไป กลับมีขุมทรัพย์ที่ยั่วยวนชวนให้ครอบครอง จะมีใครบ้างไหม กล้าพอที่จะเข้าไปครองครอบมัน,iconPath,Icons/Items/RPG/scroll,defaultCollected,FALSE,Message,ขุมสมบัติแห่งป่าต้องห้าม
ID,idea023,ideaType,Theme,ideaName,สายลับที่หายไป,ideaDescription,เมื่ออยู่ๆวันหนึ่งสายลับมือฉกาจที่องค์กรชั้นนำทั่วโลกต่างเกรงกลัว ได้วางมือจากวงการใช้ชีวิตเฉกเช่นคนธรรมดา แต่ใครจะรู้ว่าชีวิตธรรมดาในแบบของเขานี่หละที่ไม่ธรรมดา!!!,iconPath,Icons/Items/RPG/shield,defaultCollected,FALSE,Message,สายลับที่หายไป
ID,idea024,ideaType,Theme,ideaName,ความฝันหรือความจริง,ideaDescription,เมื่อความฝันกลายเป็นความจริง และความจริงกลับกลายเป็นดั่งความฝัน เรื่องไหนกันนะที่เป็นความจริงและเรื่องไหนกันที่เป็นเพียงฝัน,iconPath,Icons/Items/RPG/sword,defaultCollected,FALSE,Message,ความฝันหรือความจริง
ID,idea025,ideaType,Theme,ideaName,นักธุรกิจผู่มั่งคั่ง,ideaDescription,ความฝันของชายคนหนึ่งที่อยากขึ้นเป็นผู้ที่มั่งคั่งที่สุดจากการขายสินค้าหายาก เส้นทางของเขาจะเป็นยังไงคุณคือผู้กำหนด,iconPath,Icons/Items/RPG/sword,defaultCollected,FALSE,Message,นักธุรกิจผู่มั่งคั่ง
ID,idea030,ideaType,Platform,ideaName,PC,ideaDescription,คอมพิวเตอร์ส่วนบุคคล,iconPath,null,defaultCollected,TRUE,Message,PC
ID,idea031,ideaType,Platform,ideaName,Mobile,ideaDescription,โทรศัพท์เคลื่อนที่,iconPath,null,defaultCollected,TRUE,Message,Mobile
ID,idea032,ideaType,User,ideaName,SinglePlayer,ideaDescription,รองรับผู้เล่นคนเดียว,iconPath,null,defaultCollected,TRUE,Message,SinglePlayer
ID,idea033,ideaType,User,ideaName,Multiplayer,ideaDescription,รองรับผู้เล่นหลายคน,iconPath,null,defaultCollected,TRUE,Message,Multiplayer
